{
  "schema_version": "1.0",
  "id": "daily-nov",
  "title": "Daily November",
  "puzzles": [
    "0001",
    "0002",
    "0003",
    "0004",
    "0005"
  ],
  "difficulty_counts": {
    "easy": 5
  },
  "size_distribution": {
    "5": 3,
    "6": 2
  },
  "created_at": "2025-11-11T20:15:10.089944Z",
  "description": "Easy puzzles for November"
}